{
  "$schema": "https://json-schema.org/draft/2020-12/schema",
  "title": "ParticipaMX · municipality_segments",
  "type": "object",
  "properties": {
    "schema_version": {
      "const": "2.0.0"
    },
    "election_year": {
      "type": "integer",
      "enum": [
        2009,
        2012,
        2015,
        2018,
        2021,
        2024
      ]
    },
    "election_type": {
      "type": "string",
      "enum": [
        "presidential",
        "midterm"
      ]
    },
    "unit": {
      "const": "municipality_age_band_sex"
    },
    "source_id": {
      "const": "ine_counted_lists"
    },
    "rate_unit": {
      "const": "proportion"
    },
    "data": {
      "type": "array",
      "items": {
        "type": "object",
        "properties": {
          "row_id": {
            "type": "string"
          },
          "election_year": {
            "type": "integer",
            "enum": [
              2009,
              2012,
              2015,
              2018,
              2021,
              2024
            ],
            "minimum": 0
          },
          "state_code": {
            "type": "string"
          },
          "municipality_code": {
            "type": "string"
          },
          "age_band": {
            "type": "string",
            "enum": [
              "18-34",
              "35-59",
              "60-100",
              "101+"
            ]
          },
          "sex_code": {
            "type": "string",
            "enum": [
              "0",
              "1",
              "2"
            ]
          },
          "LN": {
            "type": [
              "integer",
              "null"
            ],
            "minimum": 0
          },
          "SV": {
            "type": [
              "integer",
              "null"
            ],
            "minimum": 0
          },
          "NV": {
            "type": [
              "integer",
              "null"
            ],
            "minimum": 0
          },
          "NS": {
            "type": [
              "integer",
              "null"
            ],
            "minimum": 0
          },
          "source_row_count": {
            "type": [
              "integer",
              "null"
            ],
            "minimum": 0
          },
          "sex_2_source_rows": {
            "type": [
              "integer",
              "null"
            ],
            "minimum": 0
          },
          "sex_2_nominal_count": {
            "type": [
              "integer",
              "null"
            ],
            "minimum": 0
          },
          "specified_count": {
            "type": [
              "integer",
              "null"
            ],
            "minimum": 0
          },
          "local_turnout": {
            "type": [
              "number",
              "null"
            ],
            "minimum": 0,
            "maximum": 1
          },
          "national_rate": {
            "type": [
              "number",
              "null"
            ],
            "minimum": 0,
            "maximum": 1
          },
          "relative_turnout": {
            "type": [
              "number",
              "null"
            ]
          },
          "unspecified_rate": {
            "type": [
              "number",
              "null"
            ],
            "minimum": 0,
            "maximum": 1
          },
          "profile_id": {
            "type": [
              "string",
              "null"
            ],
            "enum": [
              "young_favorable",
              "young_unfavorable",
              "adult_favorable",
              "adult_unfavorable",
              "older_favorable",
              "older_unfavorable",
              null
            ]
          },
          "rule_candidate_id": {
            "type": [
              "string",
              "null"
            ]
          },
          "assignment_status": {
            "type": [
              "string",
              "null"
            ]
          },
          "direction": {
            "type": [
              "integer",
              "null"
            ],
            "minimum": -1,
            "maximum": 1
          },
          "near_reference": {
            "type": [
              "boolean",
              "null"
            ]
          },
          "sufficient_support": {
            "type": [
              "boolean",
              "null"
            ]
          },
          "low_ln": {
            "type": [
              "boolean",
              "null"
            ]
          },
          "low_specified": {
            "type": [
              "boolean",
              "null"
            ]
          },
          "few_source_rows": {
            "type": [
              "boolean",
              "null"
            ]
          },
          "high_ns": {
            "type": [
              "boolean",
              "null"
            ]
          },
          "section_count": {
            "type": [
              "integer",
              "null"
            ],
            "minimum": 0
          },
          "section_ln_share_U": {
            "type": [
              "number",
              "null"
            ],
            "minimum": 0,
            "maximum": 1
          },
          "section_ln_share_R": {
            "type": [
              "number",
              "null"
            ],
            "minimum": 0,
            "maximum": 1
          },
          "section_ln_share_M": {
            "type": [
              "number",
              "null"
            ],
            "minimum": 0,
            "maximum": 1
          }
        },
        "required": [
          "row_id",
          "election_year",
          "state_code",
          "municipality_code",
          "age_band",
          "sex_code",
          "LN",
          "SV",
          "NV",
          "NS",
          "source_row_count",
          "sex_2_source_rows",
          "sex_2_nominal_count",
          "specified_count",
          "local_turnout",
          "national_rate",
          "relative_turnout",
          "unspecified_rate",
          "profile_id",
          "rule_candidate_id",
          "assignment_status",
          "direction",
          "near_reference",
          "sufficient_support",
          "low_ln",
          "low_specified",
          "few_source_rows",
          "high_ns",
          "section_count",
          "section_ln_share_U",
          "section_ln_share_R",
          "section_ln_share_M"
        ],
        "additionalProperties": false
      }
    },
    "warnings": {
      "type": "array",
      "items": {
        "type": "string"
      }
    }
  },
  "required": [
    "schema_version",
    "election_year",
    "election_type",
    "unit",
    "source_id",
    "rate_unit",
    "data",
    "warnings"
  ],
  "additionalProperties": false
}