{"schema_version":"2.0.0","election_year":2021,"election_type":"midterm","unit":"municipality_age_band_sex","source_id":"ine_counted_lists","rate_unit":"proportion","data":[{"row_id":"segment_2021|1|1|18-34|0","election_year":2021,"state_code":"1","municipality_code":"1","age_band":"18-34","sex_code":"0","LN":139171,"SV":42424,"NV":91897,"NS":4850,"source_row_count":8052,"sex_2_source_rows":0,"sex_2_nominal_count":0,"specified_count":134321,"local_turnout":0.31584041214702097,"national_rate":0.37315779659513604,"relative_turnout":-0.05731738444811507,"unspecified_rate":0.034849214275962666,"profile_id":"young_unfavorable","rule_candidate_id":"young_unfavorable","assignment_status":"supported_candidate","direction":-1,"near_reference":false,"sufficient_support":true,"low_ln":false,"low_specified":false,"few_source_rows":false,"high_ns":false,"section_count":474,"section_ln_share_U":0.8411378807366477,"section_ln_share_R":0.030846943687980972,"section_ln_share_M":0.12801517557537131},{"row_id":"segment_2021|1|1|18-34|1","election_year":2021,"state_code":"1","municipality_code":"1","age_band":"18-34","sex_code":"1","LN":138481,"SV":52426,"NV":81346,"NS":4709,"source_row_count":8048,"sex_2_source_rows":0,"sex_2_nominal_count":0,"specified_count":133772,"local_turnout":0.39190563047573485,"national_rate":0.4743429860669189,"relative_turnout":-0.08243735559118404,"unspecified_rate":0.03400466489987796,"profile_id":"young_unfavorable","rule_candidate_id":"young_unfavorable","assignment_status":"supported_candidate","direction":-1,"near_reference":false,"sufficient_support":true,"low_ln":false,"low_specified":false,"few_source_rows":false,"high_ns":false,"section_count":474,"section_ln_share_U":0.8373062008506582,"section_ln_share_R":0.03108007596710018,"section_ln_share_M":0.1316137231822416},{"row_id":"segment_2021|1|1|35-59|0","election_year":2021,"state_code":"1","municipality_code":"1","age_band":"35-59","sex_code":"0","LN":140217,"SV":61103,"NV":74431,"NS":4683,"source_row_count":11790,"sex_2_source_rows":0,"sex_2_nominal_count":0,"specified_count":135534,"local_turnout":0.4508315256688359,"national_rate":0.5077336362952798,"relative_turnout":-0.0569021106264439,"unspecified_rate":0.03339823273925416,"profile_id":"adult_unfavorable","rule_candidate_id":"adult_unfavorable","assignment_status":"supported_candidate","direction":-1,"near_reference":false,"sufficient_support":true,"low_ln":false,"low_specified":false,"few_source_rows":false,"high_ns":false,"section_count":474,"section_ln_share_U":0.8357617122032278,"section_ln_share_R":0.032007531183807954,"section_ln_share_M":0.13223075661296418},{"row_id":"segment_2021|1|1|35-59|1","election_year":2021,"state_code":"1","municipality_code":"1","age_band":"35-59","sex_code":"1","LN":154407,"SV":81085,"NV":68284,"NS":5038,"source_row_count":11808,"sex_2_source_rows":0,"sex_2_nominal_count":0,"specified_count":149369,"local_turnout":0.5428502567467145,"national_rate":0.5983504077594234,"relative_turnout":-0.05550015101270889,"unspecified_rate":0.03262805442758424,"profile_id":"adult_unfavorable","rule_candidate_id":"adult_unfavorable","assignment_status":"supported_candidate","direction":-1,"near_reference":false,"sufficient_support":true,"low_ln":false,"low_specified":false,"few_source_rows":false,"high_ns":false,"section_count":474,"section_ln_share_U":0.8434656459875524,"section_ln_share_R":0.02980434824846024,"section_ln_share_M":0.12673000576398738},{"row_id":"segment_2021|1|1|60-100|0","election_year":2021,"state_code":"1","municipality_code":"1","age_band":"60-100","sex_code":"0","LN":48953,"SV":30607,"NV":16764,"NS":1582,"source_row_count":11404,"sex_2_source_rows":0,"sex_2_nominal_count":0,"specified_count":47371,"local_turnout":0.646112600536193,"national_rate":0.6453773425605727,"relative_turnout":0.0007352579756203514,"unspecified_rate":0.03231671194819521,"profile_id":"older_favorable","rule_candidate_id":"older_favorable","assignment_status":"supported_candidate","direction":1,"near_reference":true,"sufficient_support":true,"low_ln":false,"low_specified":false,"few_source_rows":false,"high_ns":false,"section_count":474,"section_ln_share_U":0.8749821257124181,"section_ln_share_R":0.0350336036606541,"section_ln_share_M":0.08998427062692788},{"row_id":"segment_2021|1|1|60-100|1","election_year":2021,"state_code":"1","municipality_code":"1","age_band":"60-100","sex_code":"1","LN":61356,"SV":37711,"NV":21771,"NS":1874,"source_row_count":12826,"sex_2_source_rows":0,"sex_2_nominal_count":0,"specified_count":59482,"local_turnout":0.6339901146565348,"national_rate":0.6211291661954985,"relative_turnout":0.012860948461036248,"unspecified_rate":0.030543060173414172,"profile_id":"older_favorable","rule_candidate_id":"older_favorable","assignment_status":"supported_candidate","direction":1,"near_reference":true,"sufficient_support":true,"low_ln":false,"low_specified":false,"few_source_rows":false,"high_ns":false,"section_count":474,"section_ln_share_U":0.8945498402764196,"section_ln_share_R":0.026517374013951364,"section_ln_share_M":0.07893278570962906},{"row_id":"segment_2021|1|1|101+|0","election_year":2021,"state_code":"1","municipality_code":"1","age_band":"101+","sex_code":"0","LN":15,"SV":2,"NV":13,"NS":0,"source_row_count":15,"sex_2_source_rows":0,"sex_2_nominal_count":0,"specified_count":15,"local_turnout":0.13333333333333333,"national_rate":0.15439276485788114,"relative_turnout":-0.02105943152454781,"unspecified_rate":0.0,"profile_id":null,"rule_candidate_id":null,"assignment_status":"complementary","direction":-1,"near_reference":false,"sufficient_support":false,"low_ln":true,"low_specified":true,"few_source_rows":false,"high_ns":false,"section_count":14,"section_ln_share_U":0.8666666666666667,"section_ln_share_R":0.06666666666666667,"section_ln_share_M":0.06666666666666667},{"row_id":"segment_2021|1|1|101+|1","election_year":2021,"state_code":"1","municipality_code":"1","age_band":"101+","sex_code":"1","LN":42,"SV":7,"NV":35,"NS":0,"source_row_count":40,"sex_2_source_rows":0,"sex_2_nominal_count":0,"specified_count":42,"local_turnout":0.16666666666666666,"national_rate":0.10832932113625421,"relative_turnout":0.05833734553041245,"unspecified_rate":0.0,"profile_id":null,"rule_candidate_id":null,"assignment_status":"complementary","direction":1,"near_reference":false,"sufficient_support":false,"low_ln":true,"low_specified":true,"few_source_rows":false,"high_ns":false,"section_count":37,"section_ln_share_U":0.9761904761904762,"section_ln_share_R":0.023809523809523808,"section_ln_share_M":0.0},{"row_id":"segment_2021|1|10|18-34|0","election_year":2021,"state_code":"1","municipality_code":"10","age_band":"18-34","sex_code":"0","LN":8367,"SV":2913,"NV":5454,"NS":0,"source_row_count":170,"sex_2_source_rows":0,"sex_2_nominal_count":0,"specified_count":8367,"local_turnout":0.3481534600215131,"national_rate":0.37315779659513604,"relative_turnout":-0.025004336573622943,"unspecified_rate":0.0,"profile_id":"young_unfavorable","rule_candidate_id":"young_unfavorable","assignment_status":"supported_candidate","direction":-1,"near_reference":false,"sufficient_support":true,"low_ln":false,"low_specified":false,"few_source_rows":false,"high_ns":false,"section_count":10,"section_ln_share_U":0.07254691048165411,"section_ln_share_R":0.0919086888968567,"section_ln_share_M":0.8355444006214892},{"row_id":"segment_2021|1|10|18-34|1","election_year":2021,"state_code":"1","municipality_code":"10","age_band":"18-34","sex_code":"1","LN":8842,"SV":4382,"NV":4460,"NS":0,"source_row_count":170,"sex_2_source_rows":0,"sex_2_nominal_count":0,"specified_count":8842,"local_turnout":0.4955892332051572,"national_rate":0.4743429860669189,"relative_turnout":0.021246247138238306,"unspecified_rate":0.0,"profile_id":"young_favorable","rule_candidate_id":"young_favorable","assignment_status":"supported_candidate","direction":1,"near_reference":false,"sufficient_support":true,"low_ln":false,"low_specified":false,"few_source_rows":false,"high_ns":false,"section_count":10,"section_ln_share_U":0.07136394480886678,"section_ln_share_R":0.09805473874688984,"section_ln_share_M":0.8305813164442434},{"row_id":"segment_2021|1|10|35-59|0","election_year":2021,"state_code":"1","municipality_code":"10","age_band":"35-59","sex_code":"0","LN":8122,"SV":3708,"NV":4414,"NS":0,"source_row_count":250,"sex_2_source_rows":0,"sex_2_nominal_count":0,"specified_count":8122,"local_turnout":0.45653779857178034,"national_rate":0.5077336362952798,"relative_turnout":-0.05119583772349945,"unspecified_rate":0.0,"profile_id":"adult_unfavorable","rule_candidate_id":"adult_unfavorable","assignment_status":"supported_candidate","direction":-1,"near_reference":false,"sufficient_support":true,"low_ln":false,"low_specified":false,"few_source_rows":false,"high_ns":false,"section_count":10,"section_ln_share_U":0.06611672001969958,"section_ln_share_R":0.09455799064269885,"section_ln_share_M":0.8393252893376015},{"row_id":"segment_2021|1|10|35-59|1","election_year":2021,"state_code":"1","municipality_code":"10","age_band":"35-59","sex_code":"1","LN":8547,"SV":5101,"NV":3446,"NS":0,"source_row_count":250,"sex_2_source_rows":0,"sex_2_nominal_count":0,"specified_count":8547,"local_turnout":0.5968175968175968,"national_rate":0.5983504077594234,"relative_turnout":-0.0015328109418265567,"unspecified_rate":0.0,"profile_id":"adult_unfavorable","rule_candidate_id":"adult_unfavorable","assignment_status":"supported_candidate","direction":-1,"near_reference":true,"sufficient_support":true,"low_ln":false,"low_specified":false,"few_source_rows":false,"high_ns":false,"section_count":10,"section_ln_share_U":0.06984906984906986,"section_ln_share_R":0.09336609336609336,"section_ln_share_M":0.8367848367848368},{"row_id":"segment_2021|1|10|60-100|0","election_year":2021,"state_code":"1","municipality_code":"10","age_band":"60-100","sex_code":"0","LN":1958,"SV":1200,"NV":758,"NS":0,"source_row_count":302,"sex_2_source_rows":0,"sex_2_nominal_count":0,"specified_coun